{
  "schemaVersion": 1,
  "sourceCommit": "2ac0b7c3dc14e71687346868de3aa2d526355e45",
  "sourceFilesSha256": "e3619d36e10f2058dd1a670fb124203f4d06202428f7e7fb6fa2c311ab01b911",
  "apiVersion": "2026-09-22",
  "apiSourceCommit": "171a9683ff45d11a4b5d3917dc428ad2722b0d99",
  "specs": {
    "messaging": "7f6ddab25a673e45da7a209292ddfd7354acccf30c27e2fa651113e321b66d3d",
    "platform": "71454ab4bb66d844aeedd325d9a62086cd6b6ba39a135197fd4f5ca29ef089e8"
  },
  "releaseStatus": "source-only",
  "packages": {
    "typescript": { "name": "@polymorfa/sdk", "version": "0.1.0-dev.0" },
    "go": {
      "name": "github.com/polymorfa/sdks/packages/go",
      "version": "0.1.0-dev.0"
    },
    "python": { "name": "polymorfa-sdk", "version": "0.1.0.dev0" },
    "php": { "name": "polymorfa/sdk", "version": "0.1.0-dev.0" },
    "dotnet": { "name": "Polymorfa.Sdk", "version": "0.1.0-dev.0" },
    "rust": { "name": "polymorfa-sdk", "version": "0.1.0-dev.0" }
  },
  "operations": {
    "createBusinessCatalog": {
      "family": "messaging",
      "method": "POST",
      "path": "/messaging/{session}/business/catalog",
      "credentialKind": "organization_api_key",
      "request": {},
      "typescript": {
        "code": "import { MessagingClient } from \"@polymorfa/sdk\";\n\nasync function main(): Promise<void> {\n  const sdk = new MessagingClient({ credential: { type: \"apiKey\", value: \"{{POLYMORFA_API_KEY}}\" } });\n  const result = await sdk.business.createCatalog(\"{{session}}\");\n  console.log(result);\n}\n\nmain().catch((error: unknown) => { console.error(error); process.exitCode = 1; });\n"
      },
      "go": {
        "code": "package main\n\nimport (\n  \"context\"\n  \"fmt\"\n  \"log\"\n  sdk \"github.com/polymorfa/sdks/packages/go\"\n)\n\nfunc main() {\n  ctx := context.Background()\n  api, err := sdk.NewMessagingClient(sdk.Config{Credential: sdk.Credential{Kind: sdk.OrganizationAPIKey, Value: \"{{POLYMORFA_API_KEY}}\"}})\n  if err != nil { log.Fatal(err) }\n  result, err := api.Business().CreateCatalog(ctx, \"{{session}}\")\n  if err != nil { log.Fatal(err) }\n  fmt.Println(result)\n}\n"
      },
      "python": {
        "code": "import asyncio\nfrom polymorfa import AsyncMessagingClient, Credential\n\n\nasync def main() -> None:\n    async with AsyncMessagingClient(Credential(\"organization_api_key\", \"{{POLYMORFA_API_KEY}}\")) as sdk:\n        result = await sdk.business.create_catalog(\"{{session}}\")\n        print(result)\n\n\nif __name__ == \"__main__\":\n    asyncio.run(main())\n"
      },
      "php": {
        "code": "<?php\ndeclare(strict_types=1);\n\nrequire __DIR__ . \"/vendor/autoload.php\";\n\nuse Polymorfa\\MessagingClient;\nuse Polymorfa\\Credential;\n\n$sdk = (new MessagingClient(Credential::organizationApiKey(\"{{POLYMORFA_API_KEY}}\")));\n$result = $sdk->business->createCatalog(\"{{session}}\");\necho json_encode($result->data, JSON_THROW_ON_ERROR), PHP_EOL;\n"
      },
      "dotnet": {
        "code": "using System;\nusing Polymorfa.Sdk;\n\nusing var sdk = new MessagingClient(Credential.OrganizationApiKey(\"{{POLYMORFA_API_KEY}}\"));\nvar result = await sdk.Business.CreateCatalogAsync(\"{{session}}\");\nConsole.WriteLine(result);\n"
      },
      "rust": {
        "code": "use polymorfa_sdk::{MessagingClient, ClientOptions, Credential};\n\n#[tokio::main(flavor = \"current_thread\")]\nasync fn main() -> Result<(), Box<dyn std::error::Error>> {\n    let sdk = MessagingClient::new(Credential::organization_api_key(\"{{POLYMORFA_API_KEY}}\")?, ClientOptions::default())?;\n    let result = sdk.business().create_catalog(\"{{session}}\", Default::default()).await?;\n    println!(\"{:?}\", result);\n    Ok(())\n}\n"
      }
    },
    "createBusinessCollection": {
      "family": "messaging",
      "method": "POST",
      "path": "/messaging/{session}/business/collections",
      "credentialKind": "organization_api_key",
      "request": {
        "body": { "name": "Featured", "productIds": ["product-id"] }
      },
      "typescript": {
        "code": "import { MessagingClient } from \"@polymorfa/sdk\";\n\nasync function main(): Promise<void> {\n  const sdk = new MessagingClient({ credential: { type: \"apiKey\", value: \"{{POLYMORFA_API_KEY}}\" } });\n  const result = await sdk.business.createCollection(\"{{session}}\", {\"name\": \"Featured\", \"productIds\": [\"product-id\"]});\n  console.log(result);\n}\n\nmain().catch((error: unknown) => { console.error(error); process.exitCode = 1; });\n"
      },
      "go": {
        "code": "package main\n\nimport (\n  \"context\"\n  \"fmt\"\n  \"log\"\n  sdk \"github.com/polymorfa/sdks/packages/go\"\n)\n\nfunc main() {\n  ctx := context.Background()\n  api, err := sdk.NewMessagingClient(sdk.Config{Credential: sdk.Credential{Kind: sdk.OrganizationAPIKey, Value: \"{{POLYMORFA_API_KEY}}\"}})\n  if err != nil { log.Fatal(err) }\n  result, err := api.Business().CreateCollection(ctx, \"{{session}}\", sdk.BusinessCollectionCreateRequest{Name: \"Featured\", ProductIDs: []string{\"product-id\"}})\n  if err != nil { log.Fatal(err) }\n  fmt.Println(result)\n}\n"
      },
      "python": {
        "code": "import asyncio\nfrom polymorfa import AsyncMessagingClient, Credential\n\n\nasync def main() -> None:\n    async with AsyncMessagingClient(Credential(\"organization_api_key\", \"{{POLYMORFA_API_KEY}}\")) as sdk:\n        result = await sdk.business.create_collection(\"{{session}}\", {\"name\": \"Featured\", \"productIds\": [\"product-id\"]})\n        print(result)\n\n\nif __name__ == \"__main__\":\n    asyncio.run(main())\n"
      },
      "php": {
        "code": "<?php\ndeclare(strict_types=1);\n\nrequire __DIR__ . \"/vendor/autoload.php\";\n\nuse Polymorfa\\MessagingClient;\nuse Polymorfa\\Credential;\n\n$sdk = (new MessagingClient(Credential::organizationApiKey(\"{{POLYMORFA_API_KEY}}\")));\n$result = $sdk->business->createCollection(\"{{session}}\", [\"name\" => \"Featured\", \"productIds\" => [\"product-id\"]]);\necho json_encode($result->data, JSON_THROW_ON_ERROR), PHP_EOL;\n"
      },
      "dotnet": {
        "code": "using System;\nusing Polymorfa.Sdk;\n\nusing var sdk = new MessagingClient(Credential.OrganizationApiKey(\"{{POLYMORFA_API_KEY}}\"));\nvar result = await sdk.Business.CreateCollectionAsync(\"{{session}}\", new BusinessCollectionCreateRequest(\"Featured\", new[] { \"product-id\" }));\nConsole.WriteLine(result);\n"
      },
      "rust": {
        "code": "use polymorfa_sdk::{MessagingClient, ClientOptions, Credential};\n\n#[tokio::main(flavor = \"current_thread\")]\nasync fn main() -> Result<(), Box<dyn std::error::Error>> {\n    let sdk = MessagingClient::new(Credential::organization_api_key(\"{{POLYMORFA_API_KEY}}\")?, ClientOptions::default())?;\n    let result = sdk.business().create_collection(\"{{session}}\", &polymorfa_sdk::business::BusinessCollectionCreateRequest { name: \"Featured\".into(), product_ids: vec![\"product-id\".into()] }, Default::default()).await?;\n    println!(\"{:?}\", result);\n    Ok(())\n}\n"
      }
    },
    "deleteBusinessCollection": {
      "family": "messaging",
      "method": "DELETE",
      "path": "/messaging/{session}/business/collections/{collectionId}",
      "credentialKind": "organization_api_key",
      "request": {},
      "typescript": {
        "code": "import { MessagingClient } from \"@polymorfa/sdk\";\n\nasync function main(): Promise<void> {\n  const sdk = new MessagingClient({ credential: { type: \"apiKey\", value: \"{{POLYMORFA_API_KEY}}\" } });\n  const result = await sdk.business.deleteCollection(\"{{session}}\", \"{{collectionId}}\");\n  console.log(result);\n}\n\nmain().catch((error: unknown) => { console.error(error); process.exitCode = 1; });\n"
      },
      "go": {
        "code": "package main\n\nimport (\n  \"context\"\n  \"fmt\"\n  \"log\"\n  sdk \"github.com/polymorfa/sdks/packages/go\"\n)\n\nfunc main() {\n  ctx := context.Background()\n  api, err := sdk.NewMessagingClient(sdk.Config{Credential: sdk.Credential{Kind: sdk.OrganizationAPIKey, Value: \"{{POLYMORFA_API_KEY}}\"}})\n  if err != nil { log.Fatal(err) }\n  result, err := api.Business().DeleteCollection(ctx, \"{{session}}\", \"{{collectionId}}\")\n  if err != nil { log.Fatal(err) }\n  fmt.Println(result)\n}\n"
      },
      "python": {
        "code": "import asyncio\nfrom polymorfa import AsyncMessagingClient, Credential\n\n\nasync def main() -> None:\n    async with AsyncMessagingClient(Credential(\"organization_api_key\", \"{{POLYMORFA_API_KEY}}\")) as sdk:\n        result = await sdk.business.delete_collection(\"{{session}}\", \"{{collectionId}}\")\n        print(result)\n\n\nif __name__ == \"__main__\":\n    asyncio.run(main())\n"
      },
      "php": {
        "code": "<?php\ndeclare(strict_types=1);\n\nrequire __DIR__ . \"/vendor/autoload.php\";\n\nuse Polymorfa\\MessagingClient;\nuse Polymorfa\\Credential;\n\n$sdk = (new MessagingClient(Credential::organizationApiKey(\"{{POLYMORFA_API_KEY}}\")));\n$result = $sdk->business->deleteCollection(\"{{session}}\", \"{{collectionId}}\");\necho json_encode($result->data, JSON_THROW_ON_ERROR), PHP_EOL;\n"
      },
      "dotnet": {
        "code": "using System;\nusing Polymorfa.Sdk;\n\nusing var sdk = new MessagingClient(Credential.OrganizationApiKey(\"{{POLYMORFA_API_KEY}}\"));\nvar result = await sdk.Business.DeleteCollectionAsync(\"{{session}}\", \"{{collectionId}}\");\nConsole.WriteLine(result);\n"
      },
      "rust": {
        "code": "use polymorfa_sdk::{MessagingClient, ClientOptions, Credential};\n\n#[tokio::main(flavor = \"current_thread\")]\nasync fn main() -> Result<(), Box<dyn std::error::Error>> {\n    let sdk = MessagingClient::new(Credential::organization_api_key(\"{{POLYMORFA_API_KEY}}\")?, ClientOptions::default())?;\n    let result = sdk.business().delete_collection(\"{{session}}\", \"{{collectionId}}\", Default::default()).await?;\n    println!(\"{:?}\", result);\n    Ok(())\n}\n"
      }
    },
    "deleteBusinessCoverPhoto": {